{
  "schema": "https://github.com/rd2/tbd/blob/master/tbd.schema.json",
  "description": "TBD JSON example - combining building vs space PSI sets",
  "psis": [{
      "id": "OK",
      "rimjoist": 0.7,
      "parapet": 0.7,
      "fenestration": 0.7,
      "corner": 0.7,
      "balcony": 1,
      "party": 0.7,
      "grade": 0.7
    },
    {
      "id": "Awesome",
      "rimjoist": 0.2,
      "parapet": 0.2,
      "fenestration": 0.2,
      "corner": 0.2,
      "balcony": 0.3,
      "party": 0.2,
      "grade": 0.2
    }
  ],
  "building": {
    "psi": "Awesome"
  },
  "spaces": [{
    "id": "ground-floor restaurant",
    "psi": "OK"
  }]
}
