{
  "schema": "https://github.com/rd2/tbd/blob/logger/tbd.schema.json",
  "description": "testing TBD JSON for seb.osm",
  "psis": [{
      "id": "good",
      "parapet": 0.5,
      "party": 0.9
    },
    {
      "id": "compliant",
      "rimjoist": 0.3,
      "parapet": 0.325,
      "fenestration": 0.35,
      "corner": 0.45,
      "balcony": 0.5,
      "party": 0.5,
      "grade": 0.45
    }
  ],
  "building": {
    "psi": "(non thermal bridging)"
  },
  "khis": [{
      "id": "column",
      "point": 0.5
    },
    {
      "id": "support",
      "point": 0.5
    }
  ]
}
