{
  "schema": "https://github.com/rd2/tbd/blob/master/tbd.schema.json",
  "description": "sorting out multiple story PSI sets (midrise)",
  "psis": [{
      "id": "compliant",
      "rimjoist": 0.3,
      "parapet": 0.325,
      "fenestration": 0.35,
      "corner": 0.45,
      "balcony": 0.5,
      "party": 0.5,
      "grade": 0.45
    },
    {
      "id": "Building Story 1",
      "rimjoist": 0.501,
      "parapet": 0.511,
      "fenestration": 0.521,
      "cornerconcave": 0.531,
      "cornerconvex": 0.541,
      "balcony": 0.551,
      "party": 0.561,
      "grade": 0.571
    },
    {
      "id": "Building Story 2",
      "rimjoist": 0.401,
      "parapet": 0.411,
      "fenestration": 0.421,
      "cornerconcave": 0.431,
      "cornerconvex": 0.441,
      "balcony": 0.451,
      "party": 0.461,
      "grade": 0.471
    },
    {
      "id": "Building Story 3",
      "rimjoist": 0.301,
      "parapet": 0.311,
      "fenestration": 0.321,
      "cornerconcave": 0.331,
      "cornerconvex": 0.341,
      "balcony": 0.351,
      "party": 0.361,
      "grade": 0.371
    }
  ],
  "building": {
    "psi": "compliant"
  },
  "stories": [{
      "id": "Building Story 1",
      "psi": "Building Story 1"
    },
    {
      "id": "Building Story 2",
      "psi": "Building Story 2"
    },
    {
      "id": "Building Story 3",
      "psi": "Building Story 3"
    }
  ]
}
