{
  "schema": "https://github.com/rd2/tbd/blob/master/tbd.schema.json",
  "description": "testing heads, sills & jambs for test_warehouse.osm",
  "psis": [{
      "id": "detailed",
      "head": 0.500,
      "sill": 0.300,
      "jamb": 0.100
    },
    {
      "id": "compliant",
      "rimjoist": 0.3,
      "parapet": 0.325,
      "fenestration": 0.35,
      "corner": 0.45,
      "balcony": 0.5,
      "party": 0.5,
      "grade": 0.45
    }
  ],
  "building": {
    "psi": "compliant"
  },
  "surfaces": [{
    "id": "Bulk Storage Roof",
    "psi": "detailed"
  }]
}
