{
  "schema": "https://github.com/rd2/tbd/blob/master/tbd.schema.json",
  "description": "testing TBD JSON for seb.osm",
  "psis": [{
      "id": "bad",
      "fenestration": 1.1
    },
    {
      "id": "good",
      "parapet": 0.5,
      "rimjoist": 0.9
    }
  ],
  "khis": [{
      "id": "column",
      "point": 0.5
    },
    {
      "id": "support",
      "point": 0.5
    }
  ],
  "building": {
    "psi": "(non thermal bridging)"
  },
  "surfaces": [{
    "id": "Entryway  Wall 5",
    "khis": [{
        "id": "column",
        "count": 3
      },
      {
        "id": "support",
        "count": 4
      }
    ],
    "psi": "good"
  }],
  "edges": [{
    "psi": "bad",
    "type": "fenestration",
    "surfaces": [
      "Entryway  Wall 5",
      "Sub Surface 8"
    ]
  }]
}
