{
  "schema": "https://github.com/rd2/tbd/blob/master/tbd.schema.json",
  "description": "testing custom edges for test_warehouse.osm",
  "psis": [{
      "id": "bad",
      "fenestration": 0.9
    },
    {
      "id": "compliant",
      "rimjoist": 0.3,
      "parapet": 0.325,
      "fenestration": 0.35,
      "corner": 0.45,
      "balcony": 0.5,
      "party": 0.5,
      "grade": 0.45
    }
  ],
  "building": {
    "psi": "compliant"
  },
  "edges": [{
    "psi": "bad",
    "type": "fenestration",
    "surfaces": [
      "Office Left Wall Window1",
      "Office Left Wall"
    ],
    "v0x": 0.0,
    "v0y": 7.51904930207155,
    "v0z": 0.914355407629293,
    "v1x": 0.0,
    "v1y": 5.38555335093654,
    "v1z": 0.914355407629293
  }]
}
